document,sentence
Ayllupi yachasunchik 3 ñiqi Qullaw qichwapi. Texto de Comunicación del 3° Primaria - Quechua Collao,ima  kaqninkunatan  riqsichinki chay  raymimanta  utaq  riqsisqayki  chiqasmanta.
Ayllupi yachasunchik 3 ñiqi Qullaw qichwapi. Texto de Comunicación del 3° Primaria - Quechua Collao,hunt’asqa  yuyaykunata  akllasqayki  raymimanta  utaq  riqsisqayki  chiqasmanta.
Ayllupi yachasunchik 3 ñiqi Qullaw qichwapi. Texto de Comunicación del 3° Primaria - Quechua Collao,Kay riqch’akuq yupinmanhina chay imaymana niq qillqasqa  paqarichisqaykita t’ikrapuy.
Ayllupi yachasunchik 3 ñiqi Qullaw qichwapi. Texto de Comunicación del 3° Primaria - Quechua Collao,IMAYMANA NIQ QILLQASQA sutin siq’in imaymana niq  yuyaykuna paqarichiq   Wak ayllukunap kawsayninta  riqsisunchik     Kay qillqasqata ñawinchay: YUNKA SUYUPI SAN JUAN RAYMI San Juan raymiqa sapa   p’unchaw inti raymi killapim  aparikun.
Ayllupi yachasunchik 3 ñiqi Qullaw qichwapi. Texto de Comunicación del 3° Primaria - Quechua Collao,"San Martín, Loreto,  Ucayali suykunapi, ichaqa  yaqapas hinantin Yunka  ayllukunapim raymichanku."
Ayllupi yachasunchik 3 ñiqi Qullaw qichwapi. Texto de Comunicación del 3° Primaria - Quechua Collao,"Paykunaqa San Juan Bautista  sutiyuq apunkutam chay  raymipiqa tusuykunawan,  mikhuykunawan,  pukllaykunawan,  saminchaywan ima  yupaychanku."
Ayllupi yachasunchik 3 ñiqi Qullaw qichwapi. Texto de Comunicación del 3° Primaria - Quechua Collao,"Ñawpaq watakuna, arí España suyumanta tayta kurakuna  Yunka ayllunchikkunaman yaykuspa “San Juan Bautista”  patronta yupaychanankupaq kamachisqaku."
Ayllupi yachasunchik 3 ñiqi Qullaw qichwapi. Texto de Comunicación del 3° Primaria - Quechua Collao,"Chayhinaqa,  Yunkapi kawsaq runakuna huk apunkupas kallanmantaq  hinata qhawaripusqaku."
Ayllupi yachasunchik 3 ñiqi Qullaw qichwapi. Texto de Comunicación del 3° Primaria - Quechua Collao,Kay San Juan raymitaqa ñawpa kawsayninkumanhinam  rayminchanku.
Ayllupi yachasunchik 3 ñiqi Qullaw qichwapi. Texto de Comunicación del 3° Primaria - Quechua Collao,"Chaymi, “shuntus” sutiyuq ninata  hap’ichinku."
Ayllupi yachasunchik 3 ñiqi Qullaw qichwapi. Texto de Comunicación del 3° Primaria - Quechua Collao,Chay ninam yunka runakunap nunanta  ch’uyanchan; wasinkumantaq kusikuyta apan.
Ayllupi yachasunchik 3 ñiqi Qullaw qichwapi. Texto de Comunicación del 3° Primaria - Quechua Collao,Kaqllataq  Apu Yaya saminchayninwan yanapan.
Ayllupi yachasunchik 3 ñiqi Qullaw qichwapi. Texto de Comunicación del 3° Primaria - Quechua Collao,"Kallantaqmi,  chayraq riqsinakuq wayna sipaskuna, wiñaypaq  munanakunankupaq, makinkumanta hap’inakuspa  “shuntus” patanta p’itaykachanku."
Ayllupi yachasunchik 3 ñiqi Qullaw qichwapi. Texto de Comunicación del 3° Primaria - Quechua Collao,Chayhinatam San Juan apunkuqa Yunka ayllukunapi  kawsaq runakunata musuq wata qallariypi kallpachan.
Ayllupi yachasunchik 3 ñiqi Qullaw qichwapi. Texto de Comunicación del 3° Primaria - Quechua Collao,Chay imayna niq qillqasqa ñawinchasqaykimanhina kay  tapukuykunta qillqana mayt’uykipi qillqaspa kutichiy.
Ayllupi yachasunchik 3 ñiqi Qullaw qichwapi. Texto de Comunicación del 3° Primaria - Quechua Collao,¿May suyukunapin San Juan raymita rayminchanku?
Ayllupi yachasunchik 3 ñiqi Qullaw qichwapi. Texto de Comunicación del 3° Primaria - Quechua Collao,"¿Imapaqmi, “shuntus” sutiyuq ninata hap’ichinku?"
Ayllupi yachasunchik 3 ñiqi Qullaw qichwapi. Texto de Comunicación del 3° Primaria - Quechua Collao,Yachayninchikta mat’ipasun:  Imayna niq qillqa Imaynata  qillqakun.
Ayllupi yachasunchik 3 ñiqi Qullaw qichwapi. Texto de Comunicación del 3° Primaria - Quechua Collao,T’aqa t’aqapi  hunt’asqa  yuyaykunata  ch’uyanchana.
Ayllupi yachasunchik 3 ñiqi Qullaw qichwapi. Texto de Comunicación del 3° Primaria - Quechua Collao,"Imaynachus,  imakunansi kan,  imakunatas  rurakun chaykunata  riqsichinapaq."
Ayllupi yachasunchik 3 ñiqi Qullaw qichwapi. Texto de Comunicación del 3° Primaria - Quechua Collao,"Kay siq’ita qhaway, hinataq yuyaykukuy:  ¿Imatam  rurachkanku?"
Ayllupi yachasunchik 3 ñiqi Qullaw qichwapi. Texto de Comunicación del 3° Primaria - Quechua Collao,"Aylluykip hukkaq tusuyninta akllay, hinataq hatun raphipi  munayta p’achanta siqiy, llimp’iy ima."
Ayllupi yachasunchik 3 ñiqi Qullaw qichwapi. Texto de Comunicación del 3° Primaria - Quechua Collao,Chaymantataq imayna  kasqanta qillqaspa yachaq masiykikunaman riqsichiy.
Ayllupi yachasunchik 3 ñiqi Qullaw qichwapi. Texto de Comunicación del 3° Primaria - Quechua Collao,"Kay uywakunaqa may allinmi runakunapaq; maypachachus,  wakin llasa q’ipikunata q’ipinku, tarpuypi wachukunata  kichanku… Hinallataqmi wakin uywakunaqtaqa millmanta  hurqunchik, aychanta mikhunchik, lichinta ch’awanchik,  wanunta chakrakunapaq huñunchik…   Kawsayninchikmanta rimasun   Siq’ikunata qhaway, ñawinchay ima."
Ayllupi yachasunchik 3 ñiqi Qullaw qichwapi. Texto de Comunicación del 3° Primaria - Quechua Collao,"Uywanchikkuna Sapanka uywanchikkunata  p’unchawninpi munayta  t’ikachanchik, aqha ñawiwan,  winuwan ch’uyanchik, sumaq  sutinmanta rimapayanchik."
Ayllupi yachasunchik 3 ñiqi Qullaw qichwapi. Texto de Comunicación del 3° Primaria - Quechua Collao,"Chayhinam llamakunata,  paquchakunataqa kumarri pukllay  kinraypi rayminchakun “Ch’uru  Mama” nispa sutiyaspa."
Ayllupi yachasunchik 3 ñiqi Qullaw qichwapi. Texto de Comunicación del 3° Primaria - Quechua Collao,Llapan sallqa uywakunaqa  Apunchikkunap  Pachamamanchikpa uywankunan.
Ayllupi yachasunchik 3 ñiqi Qullaw qichwapi. Texto de Comunicación del 3° Primaria - Quechua Collao,"Yanqapas qasi k’irisunman chayqa,  uywanchikkunas wañupunman."
Ayllupi yachasunchik 3 ñiqi Qullaw qichwapi. Texto de Comunicación del 3° Primaria - Quechua Collao,"Apukunap uywankuna miran  chayqa, runakunap uywankunapas  mirallantaqsi."
Ayllupi yachasunchik 3 ñiqi Qullaw qichwapi. Texto de Comunicación del 3° Primaria - Quechua Collao,Yachaq masiykikunawan willanakuychik a.
Ayllupi yachasunchik 3 ñiqi Qullaw qichwapi. Texto de Comunicación del 3° Primaria - Quechua Collao,"Ñawinchasunchik Rimasqankuta ñawinchay:  Kumparíy Antonio, ¿uwihatachu  mikhunaykipaq qhawachkanki?"
Ayllupi yachasunchik 3 ñiqi Qullaw qichwapi. Texto de Comunicación del 3° Primaria - Quechua Collao,"Michiysikuchkanim, kay ch‛unkupim kumarrispi suñawasqanku malta uwihay wiñachkan."
Ayllupi yachasunchik 3 ñiqi Qullaw qichwapi. Texto de Comunicación del 3° Primaria - Quechua Collao,"Arí, sumaqta q‛aparimuchkan,  ¿imaynatataq chay  mikhunatari wayk‛unku?"
Ayllupi yachasunchik 3 ñiqi Qullaw qichwapi. Texto de Comunicación del 3° Primaria - Quechua Collao,"Francisco taytap  rayminmi kunan p‛unchaw,  chaypaqmi quwi kankayuq  uchuta wayk‛uchkanku."
Ayllupi yachasunchik 3 ñiqi Qullaw qichwapi. Texto de Comunicación del 3° Primaria - Quechua Collao,Qhipan kaq raphipi huk qillqasqa tarikun; chaypaqri kay siq’ita  qhaway.
Ayllupi yachasunchik 3 ñiqi Qullaw qichwapi. Texto de Comunicación del 3° Primaria - Quechua Collao,"Quwi kankayuq uchu Sutinmi Siq’inmi Chayri, sutinmanhina siq’inmanhina ¿ima qillqasqataq kanman?,  ¿imatataq willakunman?"
Ayllupi yachasunchik 3 ñiqi Qullaw qichwapi. Texto de Comunicación del 3° Primaria - Quechua Collao,Kay qillqasqata ñawinchay: Quwi kankayuq uchu Kanan: •	 Papa •	 Siwulla •	 Palillus •	 Asiyti •	 Quchayuyu •	 Asnapa •	 Kisu •	 Pilasqa quwi •	 Tarwi •	 Chulluchisqa  hawas t’isqa •	 Ulluku •	 Riwu hak’u •	 Runtu •	 Kachi Wayk’uynin: .
Ayllupi yachasunchik 3 ñiqi Qullaw qichwapi. Texto de Comunicación del 3° Primaria - Quechua Collao,"Sapaq mankakunapi pisi asiytita hich’aykuspa, kutasqa  palilluta, siwulla pikasqayuqtawan thiqtichiy."
Ayllupi yachasunchik 3 ñiqi Qullaw qichwapi. Texto de Comunicación del 3° Primaria - Quechua Collao,Chay  patamantaq unuta hich’aykuspa ti’impuchiy.
Ayllupi yachasunchik 3 ñiqi Qullaw qichwapi. Texto de Comunicación del 3° Primaria - Quechua Collao,"Uchu ruranapaq: hawasta, tarwita, ulluku pikasqata sapanka  mankaman churaspa t’impuchiy."
Ayllupi yachasunchik 3 ñiqi Qullaw qichwapi. Texto de Comunicación del 3° Primaria - Quechua Collao,Chaymanta papatapas  sapanka mankaman hich’aykuy.
Ayllupi yachasunchik 3 ñiqi Qullaw qichwapi. Texto de Comunicación del 3° Primaria - Quechua Collao,Qucha yuyuta t’impusqa unupi chulluchispa allinta maylliy.
Ayllupi yachasunchik 3 ñiqi Qullaw qichwapi. Texto de Comunicación del 3° Primaria - Quechua Collao,Chaymantataq tuyusqanta huqarispalla makiykiwan ch’arway.
Ayllupi yachasunchik 3 ñiqi Qullaw qichwapi. Texto de Comunicación del 3° Primaria - Quechua Collao,"Munasqaykimanhina t’impusqa uchukunaman quchayuyuta,  kisu pikata, asnapata, kachita ima churay."
Ayllupi yachasunchik 3 ñiqi Qullaw qichwapi. Texto de Comunicación del 3° Primaria - Quechua Collao,Pilasqa quwita kachiwan yawarchanwan hawirquspa  k’aspiman watarquy.
Ayllupi yachasunchik 3 ñiqi Qullaw qichwapi. Texto de Comunicación del 3° Primaria - Quechua Collao,Chaymantataq allin sansayuq q’unchapi  kankay.
Ayllupi yachasunchik 3 ñiqi Qullaw qichwapi. Texto de Comunicación del 3° Primaria - Quechua Collao,Riwu hak’uta runtuwan minuspa huk puruñapi tupachiy.
Ayllupi yachasunchik 3 ñiqi Qullaw qichwapi. Texto de Comunicación del 3° Primaria - Quechua Collao,Hinaspataq thiqtinapi t’anta sayaykunata thiqtichiy.
Ayllupi yachasunchik 3 ñiqi Qullaw qichwapi. Texto de Comunicación del 3° Primaria - Quechua Collao,"Sapanka p’ukuman ulluku, tarwi, arwihas, hawas quchayuyuq  kisuyuq uchukunata qaray."
Ayllupi yachasunchik 3 ñiqi Qullaw qichwapi. Texto de Comunicación del 3° Primaria - Quechua Collao,Patanmantaq quwi kankata  thiqtisqa t’antawan paltaykuy.
Ayllupi yachasunchik 3 ñiqi Qullaw qichwapi. Texto de Comunicación del 3° Primaria - Quechua Collao,“Manaraq mikhuruchkaspa karupi munasqayki  runakunaman phukuriy”.
Ayllupi yachasunchik 3 ñiqi Qullaw qichwapi. Texto de Comunicación del 3° Primaria - Quechua Collao,Chaninkaqta akllaspa qillqana  mayt’uykipi qillqay.
Ayllupi yachasunchik 3 ñiqi Qullaw qichwapi. Texto de Comunicación del 3° Primaria - Quechua Collao,Wayk’unapaq  kamachikuq  qillqasqata Imayna niq  qillqasqata Riqsichinapaq  qillqasqata  Qillqasqapi hunt’asqa yuyaykunap siminkunan  chaqrurqukusqa.
Ayllupi yachasunchik 3 ñiqi Qullaw qichwapi. Texto de Comunicación del 3° Primaria - Quechua Collao,Sapanka simikunata ñawinchaspa hunt’asqa  yuyayta qillqana mayt’uykipi qillqay.
Ayllupi yachasunchik 3 ñiqi Qullaw qichwapi. Texto de Comunicación del 3° Primaria - Quechua Collao,q'unchapi  Quwita sansayuq allin runtuwan huk Riwu hak'uta minuspa tupachiy.
Ayllupi yachasunchik 3 ñiqi Qullaw qichwapi. Texto de Comunicación del 3° Primaria - Quechua Collao,Uchukuna quwi patanman paltaykuy.
Ayllupi yachasunchik 3 ñiqi Qullaw qichwapi. Texto de Comunicación del 3° Primaria - Quechua Collao,"qarasqa kankata h. Kay simikuna, ñawinchasqayki qillqasqapi tarikun:  thiqtichiy t’impuchiy hich’aykuy maylliy ch’arway churay churay kankay tupachiy qaray paltaykuy •	 ¿Ima sutiwanmi kay simikunata riqsinchik?"
Ayllupi yachasunchik 3 ñiqi Qullaw qichwapi. Texto de Comunicación del 3° Primaria - Quechua Collao,"•	 Chay simikunatari qillqapiri, ¿imapaqtaq  churakun?"
Ayllupi yachasunchik 3 ñiqi Qullaw qichwapi. Texto de Comunicación del 3° Primaria - Quechua Collao,"•	 ¿Hunt’asqa yuyaypa mayqin chiqasninpitaq kay  simikunatari churakun?, ¿imaraykupi?"
Ayllupi yachasunchik 3 ñiqi Qullaw qichwapi. Texto de Comunicación del 3° Primaria - Quechua Collao,Yachaq masiykikunawan chay tapukuykunata yuyanchaychik.
Ayllupi yachasunchik 3 ñiqi Qullaw qichwapi. Texto de Comunicación del 3° Primaria - Quechua Collao,Tayta Jacinto churinkunaman rimapayasqanta ñawinchay:  ¿Imaynatam  uywakunata  mirananpaq uywana?
Ayllupi yachasunchik 3 ñiqi Qullaw qichwapi. Texto de Comunicación del 3° Primaria - Quechua Collao,"Mirananpaqqa alintam mikhuchinanchik,  ch’akiynintapas riparananchik."
Ayllupi yachasunchik 3 ñiqi Qullaw qichwapi. Texto de Comunicación del 3° Primaria - Quechua Collao,"Yarqaymanta  ch’akiymanta wañuchisunman chayqa,  uywakuna ñakawasunmanmi."
Ayllupi yachasunchik 3 ñiqi Qullaw qichwapi. Texto de Comunicación del 3° Primaria - Quechua Collao,Hinaspam  pisi pisimanta tukukapunman.
Ayllupi yachasunchik 3 ñiqi Qullaw qichwapi. Texto de Comunicación del 3° Primaria - Quechua Collao,Wasi aylluykiwan imayna uywa michiymanta Rimaychik.
Ayllupi yachasunchik 3 ñiqi Qullaw qichwapi. Texto de Comunicación del 3° Primaria - Quechua Collao,•	 Tayta mamayki uywa michinapaq kamachikusqanmanhina wak  rurana raphichapi qillqata qillqay.
Ayllupi yachasunchik 3 ñiqi Qullaw qichwapi. Texto de Comunicación del 3° Primaria - Quechua Collao,•	 Kay siq’ikunata ñiqinchaspa yanapakuy.
Ayllupi yachasunchik 3 ñiqi Qullaw qichwapi. Texto de Comunicación del 3° Primaria - Quechua Collao,Makilla  qhawaspam  p’unchawnintin  michina.
Ayllupi yachasunchik 3 ñiqi Qullaw qichwapi. Texto de Comunicación del 3° Primaria - Quechua Collao,Uywakunataqa  tutamantanmi  kanchanmanta  hurquna.
Ayllupi yachasunchik 3 ñiqi Qullaw qichwapi. Texto de Comunicación del 3° Primaria - Quechua Collao,Uywakunataqa  sukhayaykuytañam  kanchanman  qatiykapuna.
Ayllupi yachasunchik 3 ñiqi Qullaw qichwapi. Texto de Comunicación del 3° Primaria - Quechua Collao,"•	 Qillqaspaqa, ama sutinta,  riqsichikuyninta, rurayninkunata ima  churayta qunqaychu."
Ayllupi yachasunchik 3 ñiqi Qullaw qichwapi. Texto de Comunicación del 3° Primaria - Quechua Collao,Kay qillqasqata ñawinchay:  Wak ayllukunap kawsayninta Bistec Kanan: •	 Mana tulluyuq llapsa  kuchusqa aycha •	 Asiyti •	 Iskay kimsa kiru pikasqa  ahus •	 Kachi •	 Piminta kutasqa •	 Yuraq papa Wayk’uynin: .
Ayllupi yachasunchik 3 ñiqi Qullaw qichwapi. Texto de Comunicación del 3° Primaria - Quechua Collao,"Llapsa aychakunata maylliy, hinataq ch’unqaq raphiwan  ch’akichiy."
Ayllupi yachasunchik 3 ñiqi Qullaw qichwapi. Texto de Comunicación del 3° Primaria - Quechua Collao,P’alta k’ullupi aychata yanqa yanqallata saqtarqariy.
Ayllupi yachasunchik 3 ñiqi Qullaw qichwapi. Texto de Comunicación del 3° Primaria - Quechua Collao,"Kutasqa pimintawan, kutasqa ahuswan, kachiwan ima aychata  tupachiy."
Ayllupi yachasunchik 3 ñiqi Qullaw qichwapi. Texto de Comunicación del 3° Primaria - Quechua Collao,Thiqtinata chawpi yawrachkaq ninapi q’uñichiy.
Ayllupi yachasunchik 3 ñiqi Qullaw qichwapi. Texto de Comunicación del 3° Primaria - Quechua Collao,Chaymantataq iskay wisllacha asiytita hich’aykuy.
Ayllupi yachasunchik 3 ñiqi Qullaw qichwapi. Texto de Comunicación del 3° Primaria - Quechua Collao,Tupachisqa aychata thiqtinaman churay.
Ayllupi yachasunchik 3 ñiqi Qullaw qichwapi. Texto de Comunicación del 3° Primaria - Quechua Collao,Tawa tullmitahina  thiqtinanta suyay.
Ayllupi yachasunchik 3 ñiqi Qullaw qichwapi. Texto de Comunicación del 3° Primaria - Quechua Collao,Wakmantapas chayanankama t’ikray.
Ayllupi yachasunchik 3 ñiqi Qullaw qichwapi. Texto de Comunicación del 3° Primaria - Quechua Collao,"Papata mayllispa t’iqway, chaymantataq wask’a wask’achata  kuchilluwan q’allarqariy."
Ayllupi yachasunchik 3 ñiqi Qullaw qichwapi. Texto de Comunicación del 3° Primaria - Quechua Collao,Huk thiqtinapi asiytichata churaykuspa papata chayanankama  thiqtichiy.
Ayllupi yachasunchik 3 ñiqi Qullaw qichwapi. Texto de Comunicación del 3° Primaria - Quechua Collao,"Mikhunapaq hatun p’alta p’ukupi thiqtisqa aychata, thiqtisqa  papayuqtawan qaray."
Ayllupi yachasunchik 3 ñiqi Qullaw qichwapi. Texto de Comunicación del 3° Primaria - Quechua Collao,“Mikhunayki ñawpaqta karupi munasqayki runakunaman  phukuriy”.
Ayllupi yachasunchik 3 ñiqi Qullaw qichwapi. Texto de Comunicación del 3° Primaria - Quechua Collao,"Kamachina qillqakunata paqarichinaykipaq yachaykunata  mat’ipasun: Kamachina qillqa Imatapas wayk’unapaq, ruranapaq, yachanapaq  ñiqinchasqa niykunawan pusawanchik."
Ayllupi yachasunchik 3 ñiqi Qullaw qichwapi. Texto de Comunicación del 3° Primaria - Quechua Collao,"Wayk’unapaq  kamachina Ruranapaq  kamachina Yachanapaq  kamachina •	 Sutin •	 Sutin  •	 Sutin  •	 Kanan •	 Kanan •	 Riqsichikuynin •	 Wayk’uynin •	 Ruraynin •	 Yachachikuynin Wayk’uyninpi, rurayninpi, yachachikuyninpi, rimana  simikunawan kamachikun: churay, aysay, qaray, k’askachiy…  Kay siq’ita qhawaspa yuyariy: wasi aylluykipi maypin  uywakunatan uywanki chayta."
Ayllupi yachasunchik 3 ñiqi Qullaw qichwapi. Texto de Comunicación del 3° Primaria - Quechua Collao,"Hukkaq uywachata akllay,  hinataq mirananpaq, imayna  uywana kamachikuq qillqata  qillqay."
Ayllupi yachasunchik 3 ñiqi Qullaw qichwapi. Texto de Comunicación del 3° Primaria - Quechua Collao,Chay qillqasqaykitataq  Yachachiqniykiwan internetman  yaykuspa ch’iqichiwaq wak  runakuna ñawinchananpaq.
Ayllupi yachasunchik 3 ñiqi Qullaw qichwapi. Texto de Comunicación del 3° Primaria - Quechua Collao,Mikhuy waqaychana taqi  wasitapas insinsuwan sumaqta saminchana.
Ayllupi yachasunchik 3 ñiqi Qullaw qichwapi. Texto de Comunicación del 3° Primaria - Quechua Collao,"Kawsayninchikmanta rimasunchik   Siq’ikunata qhaway, ñawinchay ima."
Ayllupi yachasunchik 3 ñiqi Qullaw qichwapi. Texto de Comunicación del 3° Primaria - Quechua Collao,Haywarikuy Pachamanchikman  Apunchikkunamanpas tukuy  sunqunchikwanmi hunt’asqa  misata haywarinchik.
Ayllupi yachasunchik 3 ñiqi Qullaw qichwapi. Texto de Comunicación del 3° Primaria - Quechua Collao,"Maqllakuspa, phiña phiñapas,  qilla qillapas haywasunman  chayqa, manas allintachu  chaskiwasunman."
Ayllupi yachasunchik 3 ñiqi Qullaw qichwapi. Texto de Comunicación del 3° Primaria - Quechua Collao,"Hinallataqmi, qhapaq sitwa  killa q’uñi kaptin riqsinakuq  wayna sipaskuna kasaranku."
Ayllupi yachasunchik 3 ñiqi Qullaw qichwapi. Texto de Comunicación del 3° Primaria - Quechua Collao,Kaqllataqmi aylluyup  wayna sipaskuna wasinkuta  hatarichispa wasichanku.
Ayllupi yachasunchik 3 ñiqi Qullaw qichwapi. Texto de Comunicación del 3° Primaria - Quechua Collao,¿Imanaptintaq maqllakuspa mana Pachamamanchikman 	 	 haywakunachu?
Ayllupi yachasunchik 3 ñiqi Qullaw qichwapi. Texto de Comunicación del 3° Primaria - Quechua Collao,"¿Qhapaq sitwa qallariy p’unchawkunapi, imatam 	 	 	 aylluykichikpi rurankichik?"
Ayllupi yachasunchik 3 ñiqi Qullaw qichwapi. Texto de Comunicación del 3° Primaria - Quechua Collao,"h.	 Tayta mamaykiwan, awichaykikunawan rimaspayki tapuy 	 	 ¿imaynatam wasita rurankichik?"
Ayllupi yachasunchik 3 ñiqi Qullaw qichwapi. Texto de Comunicación del 3° Primaria - Quechua Collao,"Ñawinchasunchik Rimasqankuta ñawinchay:  Diego, ¿¿imatam rurachkanki?,  ¿imapaqmi utqayllata  hasp’ichkanki?"
Ayllupi yachasunchik 3 ñiqi Qullaw qichwapi. Texto de Comunicación del 3° Primaria - Quechua Collao,"Kumparíy Antonio, allichá  yanapaqniy hamuchkanki."
Ayllupi yachasunchik 3 ñiqi Qullaw qichwapi. Texto de Comunicación del 3° Primaria - Quechua Collao,Kay mallki sikichapim  wasita rurakusaq.
Ayllupi yachasunchik 3 ñiqi Qullaw qichwapi. Texto de Comunicación del 3° Primaria - Quechua Collao,"¡Allinmi, kumparíy!, llapapas wasichanchikpi sumaqta tiyanchik."
Ayllupi yachasunchik 3 ñiqi Qullaw qichwapi. Texto de Comunicación del 3° Primaria - Quechua Collao,Ichaqa manam unayqa saqinachu.
Ayllupi yachasunchik 3 ñiqi Qullaw qichwapi. Texto de Comunicación del 3° Primaria - Quechua Collao,Saqinchik  chayqa llakikuymantas utqaylla  mawk’ayapun.
Ayllupi yachasunchik 3 ñiqi Qullaw qichwapi. Texto de Comunicación del 3° Primaria - Quechua Collao,"Kay siq’ita qhawaspa, tapukuykunamanta rimaspa  kutichisunchik."
Ayllupi yachasunchik 3 ñiqi Qullaw qichwapi. Texto de Comunicación del 3° Primaria - Quechua Collao,"Kay siq’i qhawasqaykipi,  a."
Ayllupi yachasunchik 3 ñiqi Qullaw qichwapi. Texto de Comunicación del 3° Primaria - Quechua Collao,h.	 ¿Imaynatataq chay siq’ipi  runakunata rimachiwaq.
Ayllupi yachasunchik 3 ñiqi Qullaw qichwapi. Texto de Comunicación del 3° Primaria - Quechua Collao,"Kay qillqasqata ñawinchay: WASI RURANAPAQ ALLICHAKUY Huk p'unchawsi Anachaqa, Roberto qusanwan   wasi ruranankupaq rimanakusqaku."
Ayllupi yachasunchik 3 ñiqi Qullaw qichwapi. Texto de Comunicación del 3° Primaria - Quechua Collao,"Qusay,  hinaspapas inti  qhawariqmi kanan;  allin kallpayuq, tukuy  sunquyuq mana  phiñanakuspalla,  sumaqta kawsakuspa  tiyakunanchikpaq."
Ayllupi yachasunchik 3 ñiqi Qullaw qichwapi. Texto de Comunicación del 3° Primaria - Quechua Collao,"Ana, wasichanchiktaqa  ch'ila pampapi  rurasunchik, ama  ch'aranyaq allpapiqa,  wak'akunap  kasqanpiqa  rurasunchikchu."
Ayllupi yachasunchik 3 ñiqi Qullaw qichwapi. Texto de Comunicación del 3° Primaria - Quechua Collao,Chayhinaqa Ana mamaqa qusanwan rimanakuspa simintuta  churachinqaku pirqakunata sayarichinankupaq.
Ayllupi yachasunchik 3 ñiqi Qullaw qichwapi. Texto de Comunicación del 3° Primaria - Quechua Collao,"Munasqay urpilláy, simintu  churananchikpaqqa  huch’uy  tuminchakunata, chuntata,  utkuta, wilata, winuta, kukata  ima allichanki."
Ayllupi yachasunchik 3 ñiqi Qullaw qichwapi. Texto de Comunicación del 3° Primaria - Quechua Collao,"Allinmi, qusáy, sumaqta  wasinchikta hatarichisun  Chunta k’aspi churaypas  allinmi layqakunamanta, unquykunamanta ima  hark’awasun."
Ayllupi yachasunchik 3 ñiqi Qullaw qichwapi. Texto de Comunicación del 3° Primaria - Quechua Collao,"Hinallataq Roberto taytaqa Ana warminwan Wasi ruray yachaq  taytaman, yanapakuqkunaman ima mink’akuq purinankupaq  rimanakunku."
Ayllupi yachasunchik 3 ñiqi Qullaw qichwapi. Texto de Comunicación del 3° Primaria - Quechua Collao,"Arí, allinmi nisqayki,  urpilláy."
Ayllupi yachasunchik 3 ñiqi Qullaw qichwapi. Texto de Comunicación del 3° Primaria - Quechua Collao,Kumparinchik  Simón taytaman risunchik.
Ayllupi yachasunchik 3 ñiqi Qullaw qichwapi. Texto de Comunicación del 3° Primaria - Quechua Collao,"Payqa rurasqanqa munaysi,  q’uñitaqsi kanpas."
Ayllupi yachasunchik 3 ñiqi Qullaw qichwapi. Texto de Comunicación del 3° Primaria - Quechua Collao,"Roberto qusáy,  Quwi kankantin rispachá sumaqta wasi  ruray yachaq taytata walikamusunman."
Ayllupi yachasunchik 3 ñiqi Qullaw qichwapi. Texto de Comunicación del 3° Primaria - Quechua Collao,Chayhinaqa Roberto taytaqa Ana warmanwan munayta  wasinkuta hatarichispa wasichasqaku.
Ayllupi yachasunchik 3 ñiqi Qullaw qichwapi. Texto de Comunicación del 3° Primaria - Quechua Collao,Chaypis kunanqa munayta  wawakunantin tiyanku.
Ayllupi yachasunchik 3 ñiqi Qullaw qichwapi. Texto de Comunicación del 3° Primaria - Quechua Collao,Kay tapukuykunata qillqana mayt’uykipi qillqaspa kutichiy:  a.
Ayllupi yachasunchik 3 ñiqi Qullaw qichwapi. Texto de Comunicación del 3° Primaria - Quechua Collao,Kamachikuq  qillqasqa Asikunapaq  qillqasqa T’iktusqa  willakuy ch.
Ayllupi yachasunchik 3 ñiqi Qullaw qichwapi. Texto de Comunicación del 3° Primaria - Quechua Collao,huchatarispa sumaqpi chansanakuspa ¿Mayqin rimasqanku simikunan chayhinata yuyaychachisunki?
Ayllupi yachasunchik 3 ñiqi Qullaw qichwapi. Texto de Comunicación del 3° Primaria - Quechua Collao,qillqana mayt’uykipi chay simikunata qillqay.
Ayllupi yachasunchik 3 ñiqi Qullaw qichwapi. Texto de Comunicación del 3° Primaria - Quechua Collao,Imanispataq Simón tayta uyakunanpaq  walikunkuman karqan.
Ayllupi yachasunchik 3 ñiqi Qullaw qichwapi. Texto de Comunicación del 3° Primaria - Quechua Collao,"Qillqana mayt’uykipi (cuaderno)  qillqay: Ana mama:  (rimasqanta qillqana mayt’uykipi qillqay)  (rimasqanta qillqana mayt’uykipi qillqay)  Roberto tayta:  (rimasqanta qillqana mayt’uykipi qillqay)  Roberto tayta:    T’iktusqa willakuypa kaqninkunata riqsisunchik:  Wasi ruray yachaq tayta  Juanqa, wasi ruranapaq mana  allin chiqas kasqanta willan."
Ayllupi yachasunchik 3 ñiqi Qullaw qichwapi. Texto de Comunicación del 3° Primaria - Quechua Collao,Pedro waynaqa wasi ruray  yachaq taytata allpanman  pusan.
Ayllupi yachasunchik 3 ñiqi Qullaw qichwapi. Texto de Comunicación del 3° Primaria - Quechua Collao,Manam  manchakunichu; allillanmi chay  chiqaspi kanqa…  ¡Kay allpapi wasi rurayqa manam  allinchu!
Ayllupi yachasunchik 3 ñiqi Qullaw qichwapi. Texto de Comunicación del 3° Primaria - Quechua Collao,"Pedro, siqwinqa qurakunap tupayninpi rurayqa manam allinchu."
Ayllupi yachasunchik 3 ñiqi Qullaw qichwapi. Texto de Comunicación del 3° Primaria - Quechua Collao,T’iktusqa willakuypa  kaqninkuna Rimana phukuchukuna T'iktusqa willakuypa  kaqninkuna  Rimana phukuchukuna  Rimanakuy.
Ayllupi yachasunchik 3 ñiqi Qullaw qichwapi. Texto de Comunicación del 3° Primaria - Quechua Collao,T’aqap willakuynin T’iktu t’aqap tawa k’uchun Siq'i Rimana phukuchu Pisi kunkalla  rimay.
Ayllupi yachasunchik 3 ñiqi Qullaw qichwapi. Texto de Comunicación del 3° Primaria - Quechua Collao,"Irqikunap, waynakunap, sipaskunap, taytakunap, mamakunap,  awichakunap siq’inta k’aspichaman k’achkarqachispa yachaq  masiykikunawan rimaykunata paqarichiychik."
Ayllupi yachasunchik 3 ñiqi Qullaw qichwapi. Texto de Comunicación del 3° Primaria - Quechua Collao,"Wak ayllukunap kawsayninmanta   Kay qillqasqata ñawinchay: HUK LLAQTAKUNAPI WASI RURAY Ayllukunap kawsayninmanta rimana tinkuypi irqichakuna wasi  ruraymanta rimasqaku… Ñuqataq  Limamanta.. Imaynalla,  ñuqa  matsigenka kani Ñuqataq  Shipibo  ayllumanta  kani."
